{
  "schemaVersion": 1,
  "minimumObsidianVersion": "1.8.7",
  "releaseObsidianVersion": "1.13.7",
  "cells": [
    {
      "id": "framework-desktop-minimum",
      "status": "pending",
      "platform": "desktop-linux",
      "deviceModel": "Framework Desktop AMD Ryzen AI Max 300 Series",
      "hardwareProfile": "Framework Desktop FRAMDACP06 A6",
      "osName": "Fedora Linux",
      "osVersion": "44",
      "osBuild": "Linux 7.1.8-200.fc44.x86_64",
      "obsidianVersion": "1.8.7",
      "importedApis": ["Plugin"],
      "expectedCapabilities": ["production plugin load and unload"],
      "guardedFallbacks": [],
      "blocker": "Obsidian 1.8.7 has not yet been installed and tested on this device."
    },
    {
      "id": "framework-desktop-release",
      "status": "pending",
      "platform": "desktop-linux",
      "deviceModel": "Framework Desktop AMD Ryzen AI Max 300 Series",
      "hardwareProfile": "Framework Desktop FRAMDACP06 A6",
      "osName": "Fedora Linux",
      "osVersion": "44",
      "osBuild": "Linux 7.1.8-200.fc44.x86_64",
      "obsidianVersion": "1.13.7",
      "importedApis": ["Plugin"],
      "expectedCapabilities": ["production plugin load and unload"],
      "guardedFallbacks": [],
      "blocker": "The release-version test run has not yet been recorded."
    },
    {
      "id": "galaxy-book-release",
      "status": "pending",
      "platform": "desktop-windows",
      "deviceModel": "Samsung Galaxy Book 5 Pro 360",
      "hardwareProfile": null,
      "osName": null,
      "osVersion": null,
      "osBuild": null,
      "obsidianVersion": "1.13.7",
      "importedApis": ["Plugin"],
      "expectedCapabilities": ["production plugin load and unload"],
      "guardedFallbacks": [],
      "blocker": "Exact hardware profile, operating system, build, and test result are not yet recorded."
    },
    {
      "id": "galaxy-tab-s6-minimum",
      "status": "pending",
      "platform": "android",
      "deviceModel": "Samsung Galaxy Tab S6",
      "hardwareProfile": null,
      "osName": "Android",
      "osVersion": null,
      "osBuild": null,
      "obsidianVersion": "1.8.7",
      "importedApis": ["Plugin"],
      "expectedCapabilities": ["production plugin load and unload"],
      "guardedFallbacks": [],
      "blocker": "Exact Android version, build, and minimum-version test result are not yet recorded."
    },
    {
      "id": "galaxy-tab-s6-release",
      "status": "pending",
      "platform": "android",
      "deviceModel": "Samsung Galaxy Tab S6",
      "hardwareProfile": null,
      "osName": "Android",
      "osVersion": null,
      "osBuild": null,
      "obsidianVersion": "1.13.7",
      "importedApis": ["Plugin"],
      "expectedCapabilities": ["production plugin load and unload"],
      "guardedFallbacks": [],
      "blocker": "Exact Android version, build, and release-version test result are not yet recorded."
    },
    {
      "id": "galaxy-s25-ultra-release",
      "status": "pending",
      "platform": "android",
      "deviceModel": "Samsung Galaxy S25 Ultra",
      "hardwareProfile": null,
      "osName": "Android",
      "osVersion": null,
      "osBuild": null,
      "obsidianVersion": "1.13.7",
      "importedApis": ["Plugin"],
      "expectedCapabilities": ["production plugin load and unload"],
      "guardedFallbacks": [],
      "blocker": "Exact Android version, build, and release-version test result are not yet recorded."
    },
    {
      "id": "ios-minimum",
      "status": "blocked",
      "platform": "ios",
      "deviceModel": null,
      "hardwareProfile": null,
      "osName": "iOS or iPadOS",
      "osVersion": null,
      "osBuild": null,
      "obsidianVersion": "1.8.7",
      "importedApis": ["Plugin"],
      "expectedCapabilities": ["production plugin load and unload"],
      "guardedFallbacks": [],
      "blocker": "No physical iPhone or iPad test device has been declared."
    },
    {
      "id": "ios-release",
      "status": "blocked",
      "platform": "ios",
      "deviceModel": null,
      "hardwareProfile": null,
      "osName": "iOS or iPadOS",
      "osVersion": null,
      "osBuild": null,
      "obsidianVersion": "1.13.7",
      "importedApis": ["Plugin"],
      "expectedCapabilities": ["production plugin load and unload"],
      "guardedFallbacks": [],
      "blocker": "No physical iPhone or iPad test device has been declared."
    }
  ]
}
